{
  "$schema": "https://json-schema.org/draft/2020-12/schema",
  "$id": "https://open-subsurface-data.org/schema/verification/2",
  "title": "Verification record, version 2",
  "description": "What our tools established about one record on one date. Written by `osd verify`, never by hand. The level is the highest level whose every check passed.",
  "type": "object",
  "additionalProperties": false,
  "required": ["record_id", "checked_at", "tool_version", "level", "checks"],
  "properties": {
    "record_id": {"type": "string"},
    "checked_at": {"type": "string", "format": "date-time"},
    "tool_version": {"type": "string"},
    "level": {"type": "string", "enum": ["L0", "L1", "L2", "L3", "L4"],
              "description": "L0 listed; L1 origin reachable; L2 files checksummed and licence text captured; L3 outlines extracted by a reader; L4 converted to a canonical type with a fidelity record"},
    "checks": {
      "type": "array",
      "items": {
        "type": "object", "additionalProperties": false,
        "required": ["name", "level", "outcome"],
        "properties": {
          "name": {"type": "string"},
          "level": {"type": "string", "enum": ["L1", "L2", "L3", "L4"]},
          "outcome": {"type": "string", "enum": ["pass", "fail", "skip"]},
          "detail": {"type": "string", "maxLength": 500}
        }
      }
    },
    "origin": {
      "type": "object", "additionalProperties": false,
      "properties": {
        "http_status": {"type": "integer"},
        "final_url": {"type": "string"},
        "content_type": {"type": "string"},
        "elapsed_ms": {"type": "integer"},
        "reachability": {"type": "string", "enum": ["ok", "blocked", "moved", "dead"],
                         "description": "v2. blocked: 403/429 or a challenge page, awards no level (OSD-D9); ok: 2xx/3xx on the origin host; moved: 2xx/3xx on another host; dead: anything else (timeouts, refused connections and 5xx after one retry)"},
        "blocked_since": {"type": "string", "format": "date-time", "description": "v2. First check of the current unbroken blocked run"}
      }
    },
    "files": {
      "type": "array",
      "items": {
        "type": "object", "additionalProperties": false, "required": ["path", "bytes", "sha256"],
        "properties": {"path": {"type": "string", "description": "As the listing states it"}, "url": {"type": "string", "description": "v2. Where it was fetched"}, "bytes": {"type": "integer"}, "sha256": {"type": "string", "pattern": "^[0-9a-f]{64}$"}}
      }
    },
    "licence_text_sha256": {"type": "string", "pattern": "^[0-9a-f]{64}$"},
    "licence_text": {"type": "string", "maxLength": 100000, "description": "v2. The visible licence text the hash was computed over, whitespace collapsed"}
  }
}
