{
  "record_id": "tno/olympus",
  "checked_at": "2026-10-24T04:48:23+00:00",
  "tool_version": "0.1.0",
  "level": "L1",
  "checks": [
    {
      "name": "origin-reachable",
      "level": "L1",
      "outcome": "pass",
      "detail": "HTTP 206 from https://www.isapp2.com/optimization-challenge.html"
    },
    {
      "name": "files-checksummed",
      "level": "L2",
      "outcome": "skip",
      "detail": "no origin.manifest_url"
    },
    {
      "name": "licence-text-captured",
      "level": "L2",
      "outcome": "pass",
      "detail": "2988 characters captured from https://www.isapp2.com/optimization-challenge/optimization-challenge-download-files.html"
    },
    {
      "name": "outline-present",
      "level": "L3",
      "outcome": "fail",
      "detail": "no outlines file"
    },
    {
      "name": "canonical-conversion",
      "level": "L4",
      "outcome": "skip",
      "detail": "no fidelity record (osd verify <id> --fidelity-from)"
    }
  ],
  "origin": {
    "http_status": 206,
    "final_url": "https://www.isapp2.com/optimization-challenge.html",
    "content_type": "text/html",
    "elapsed_ms": 1094,
    "reachability": "ok"
  },
  "licence_text_sha256": "01e3cf0a00932435d7737b068d94ae4da575297c163cc021e5573e7a2bc87e1d",
  "licence_text": "Home About ISAPP Collaboration NEWS Projects and Publications Optimization Challenge Contact Data sharepoint Directly to ... Motivation and background Reservoir model description Problem statement Reservoir model files description Timeline Support Frequently Asked Questions Optimization Challenge download files Optimization Challenge Optimization challenge download files All documentation and input decks for the ISAPP Field Development Optimization Challenge are made available to you under the following conditions: (c) 2017 TNO, The Hague, the Netherlands. All copyrights and other intellectual property rights reserved. Parts of this compilation work were contributed by certain third parties, as specifically mentioned in those parts Documents and Eclipse input decks (and the related include files) have been prepared for the ISAPP field development optimization challenge as requested out of the ISAPP research program. The files pertain to a reservoir-model based on synthetic data assembled for the fictitious field referred to as \u201cOlympus\u201d and to the definition of the ISAPP optimization benchmark challenge for the field. All the files are provided on a strict \u201cas is\u201d basis (via www.isapp2.com). TNO does not assume any responsibility or liability for any damage that might result from its use by you. You may redistribute the files for your own purposes, however all references to TNO in the file headers should be maintained as is and the files must remain unchanged. Reasonable changes to the files as proposed by you will be considered by TNO. Compatible input decks (and the related include files) for the Eclipse model generated by TNO for the fictitious field \u201cOlympus\u201d have been prepared for the ISAPP field development optimization challenge. These files concern decks for IMEX obtained with support from CMG, for AD-GPRS generated by Stanford University, for OPM FLOW obtained with support from SINTEF on behalf of the OPM initiative, for INTERSECT generated by Schlumberger, and for NEXUS generated by Halliburton. All the files are provided on a strict \u201cas is\u201d basis (via www.isapp2.com ). TNO and the parties CMG, Stanford University, SINTEF, Schlumberger and Halliburton do not assume any responsibility or liability for any damage that might result from its use by you. You may redistribute the files for your own purposes, however all references to TNO and these parties in the file headers should be maintained as is and the files must remain unchanged. Reasonable changes to the files as proposed by you will be considered by TNO and these parties. All Olympus input decks are provided to you via a few zip-files. To get acces, please register via a request to one of the contact persons found on the support page . Optimization Challenge Documentation Optimization Challenge OLYMPUS Reservoir Model Description 1.3 MB Optimization Challenge Problem Statement 771.4 KB Optimization Challenge OLYMPUS Reservoir Model files description 450,9 KB ISAPP \u00a9 2017"
}
