{
  "record_id": "fig-dmr/offshore-data-release",
  "checked_at": "2026-10-24T04:40:08+00:00",
  "tool_version": "0.1.0",
  "level": "L1",
  "checks": [
    {
      "name": "origin-reachable",
      "level": "L1",
      "outcome": "pass",
      "detail": "HTTP 206 from https://www.gov.fk/mineralresources/regulatory/data-management/"
    },
    {
      "name": "files-checksummed",
      "level": "L2",
      "outcome": "skip",
      "detail": "no origin.manifest_url"
    },
    {
      "name": "licence-text-captured",
      "level": "L2",
      "outcome": "skip",
      "detail": "no licence.url"
    },
    {
      "name": "outline-present",
      "level": "L3",
      "outcome": "fail",
      "detail": "no outlines file"
    },
    {
      "name": "canonical-conversion",
      "level": "L4",
      "outcome": "skip",
      "detail": "no fidelity record (osd verify <id> --fidelity-from)"
    }
  ],
  "origin": {
    "http_status": 206,
    "final_url": "https://www.gov.fk/mineralresources/regulatory/data-management/",
    "content_type": "text/html; charset=UTF-8",
    "elapsed_ms": 779,
    "reachability": "ok"
  }
}
