{
  "record_id": "lgt/geologiniai-tyrimai",
  "checked_at": "2026-10-28T07:15:02+00:00",
  "tool_version": "0.1.0",
  "level": "L0",
  "checks": [
    {
      "name": "origin-reachable",
      "level": "L1",
      "outcome": "fail",
      "detail": "HTTP 500 from https://data.gov.lt/datasets/1325/"
    },
    {
      "name": "files-checksummed",
      "level": "L2",
      "outcome": "skip",
      "detail": "origin not reachable"
    },
    {
      "name": "licence-text-captured",
      "level": "L2",
      "outcome": "skip",
      "detail": "origin not reachable"
    },
    {
      "name": "outline-present",
      "level": "L3",
      "outcome": "fail",
      "detail": "no outlines file"
    },
    {
      "name": "canonical-conversion",
      "level": "L4",
      "outcome": "skip",
      "detail": "no fidelity record (osd verify <id> --fidelity-from)"
    }
  ],
  "origin": {
    "http_status": 500,
    "final_url": "https://data.gov.lt/datasets/1325/",
    "content_type": "text/html",
    "elapsed_ms": 1214,
    "reachability": "dead"
  }
}
