{
  "record_id": "cnloer/core-inventory",
  "checked_at": "2026-10-28T07:06:01+00:00",
  "tool_version": "0.1.0",
  "level": "L2",
  "checks": [
    {
      "name": "origin-reachable",
      "level": "L1",
      "outcome": "pass",
      "detail": "HTTP 200 from https://www.cnloer.ca/geoscience/"
    },
    {
      "name": "files-checksummed",
      "level": "L2",
      "outcome": "pass",
      "detail": "sample, not the whole dataset: 1 of 1 selected files hashed (172001 bytes); 92 entries listed"
    },
    {
      "name": "licence-text-captured",
      "level": "L2",
      "outcome": "pass",
      "detail": "6756 characters captured from https://www.cnloer.ca/disclaimer/"
    },
    {
      "name": "outline-present",
      "level": "L3",
      "outcome": "fail",
      "detail": "no outlines file"
    },
    {
      "name": "canonical-conversion",
      "level": "L4",
      "outcome": "skip",
      "detail": "no fidelity record (osd verify <id> --fidelity-from)"
    }
  ],
  "origin": {
    "http_status": 200,
    "final_url": "https://www.cnloer.ca/geoscience/",
    "content_type": "text/html; charset=UTF-8",
    "elapsed_ms": 2123,
    "reachability": "ok"
  },
  "files": [
    {
      "path": "https://www.cnlopb.ca/wp-content/uploads/geoinfo/coreinv.xlsx",
      "url": "https://www.cnlopb.ca/wp-content/uploads/geoinfo/coreinv.xlsx",
      "bytes": 172001,
      "sha256": "1370db96169fb721a8dee0d8a8b0060ea25830dcd68ae302f9ced20827c6ecec"
    }
  ],
  "licence_text_sha256": "a18a988d731e1ac72515bf214ec453ed73915d0f75531baee1b407f86915b920",
  "licence_text": "Disclaimer, Copyright Privacy Statement Bay du Nord Data and Information Hub C-NLOER News Careers Twitter Youtube Fran\u00e7ais Search About Us Board of Directors Management Team Strategic Framework C-NLOER Bilingual Services The Tower Corporate Campus Core Storage and Research Centre Organizational Structure Contact Us Offshore Activities Canada-Newfoundland and Labrador Offshore Area Producing Projects Production Data Resource Information Strategic Environmental Assessment Project-Based Environmental Assessments Regional Assessment of Offshore Oil and Gas Exploratory Drilling East of Newfoundland and Labrador Compliance & Enforcement About Compliance and Enforcement Compliance Monitoring and Verification Enforcement Tools Reporting and Investigating Incidents Work Refusals Incident Disclosure Legislation & Guidance Statutes Regulations Substitutions or Exemptions Chief Safety Officer Approvals Guidelines and Interpretation Notes Codes of Practice Safety Notices Authorizations & Approvals Additional Requirements Operating Licence Certificate of Fitness Well Operations Organizational Culture Information & Reports Annual Reports By-Law Information Resources Centre Formula Fees Schedule Forms Geoscience Information Resource Information Maps and Charts Development Plans Decision Reports Statistical Information Access to Information and Privacy Travel and Hospitality Expense Reports InfoSource Memoranda of Understanding Offshore Related Reports Links CNLOPB Glossary Disclaimer, Copyright Privacy Statement Disclaimer, Copyright Privacy Statement General Disclaimer The C-NLOPB maintains this Website to help the public and non-government organizations obtain information about the Board and petroleum activities in the Newfoundland and Labrador Offshore Area. The Board cannot warrant that the information contained on the Website is current, complete or accurate given the dynamic regulatory environment. Information is provided to users without guarantee, warranty or responsibility of any kind either express or implied. As a result, the Board and staff of the Board do not assume any liability deemed to have been caused directly or indirectly by reliance upon information maintained on this Website including any information provided at any other site that may be linked via this Website. Links from this Website to other websites are provided to facilitate access to information related to the regulation of petroleum activity in the Newfoundland and Labrador Offshore Area. The Board cannot guarantee or accept responsibility for the accuracy, completeness or correctness of information contained on any linked sites. The C-NLOPB does not warrant that this website will be uninterrupted or error free. Nor does the C-NLOPB warrant that the website and its supporting infrastructure is error free from any virus or harmful effects. All content and information on the website may be changed without notice or improvements made at anytime. General Copyright The information and materials provided on this Website are covered by the provisions of the Copyright Act and the laws of the Province of Newfoundland and Labrador and Canada. Unless otherwise stated, the Board is the owner of all information maintained on the Website including Board WebPages, maps and publications. The Website is provided to make the information accessible to the public and stakeholders. Unauthorized use or reproduction of these materials, either in whole or in part, is strictly prohibited. To seek permission to reproduce any Board materials for commercial purposes, please contact the Information and Privacy Coordinator at 709-778-1467. Where it is otherwise stated that the materials have been provided by third parties, users should contact those entities to seek permission to reproduce those materials. General Privacy Statement The Board is committed to protecting the personal privacy of individuals and organizations who visit this Website. Any personal information which you supply to the Board via e-mail or correspondence, is considered by the Board to be confidential. Such information collected by the Board is protected under the Privacy Act RSC c. P-21 and also, the Board follows the intent and spirit of the privacy provisions of the under the Access to Information and Protection of Privacy Act SNL c. A-1.1. This information will not to be disclosed to anyone except C-NLOPB personnel in the course of employment. Any further disclosure of the personal information you may give us will be in accordance with the above-noted legislation. If you have issues or questions with respect to the C-NLOPB\u2019s Privacy Statement, or wish to access or correct your personal information, please contact the Access to Information and Privacy Coordinator at 709-778-1467. Career Opportunities Disclaimer Any personal information you submit to the C-NLOPB in support of an application for employment is protected under the Privacy Act RSC c. P-21 and also, the Board follows the intent and spirit of the privacy provisions under the Access to Information and Protection of Privacy Act SNL c. A-1.1. This information will be used for the evaluation of your qualifications and suitability for employment with the Board. Use of this information will be limited to human resources staff and any other employees directly involved in the review of applications for this competition. By submitting your personal information to the C-NLOPB in support of an application for employment, you are consenting to the collection, use and disclosure of your personal information as set out above. If you have issues or questions with respect to the C-NLOPB\u2019s Privacy Statement, or wish to access or correct your personal information, contact the Access to Information and Privacy Coordinator at 709-778-1467. Bilingual Disclaimer The translation of content on the C-NLOPB French Website is the responsibility of Natural Resources Canada. The Government of Canada respects the Official Languages Act and is committed to ensuring that our information is available in both French and English and that both versions are of equal quality. Users are advised that translation of the C-NLOPB\u2019s website and its web pages may be imprecise and inaccurate, in whole or in part. If there is any discrepancy between the English and the French content found on the www.cnlopb.ca and www.ctnlohe.ca websites, the English version will prevail. The C-NLOPB does not assume any liability whatsoever with respect to any damages or losses incurred as a result of such discrepancy. Safety Environment Exploration and Licencing Resource Management Industrial Benefits Disclaimer, Copyright Privacy Statement Bay du Nord Data and Information Hub C-NLOER News Careers Twitter Youtube Fran\u00e7ais"
}
